{
  "profile_version": 1,
  "recommended_level": "A",
  "confidence": "low",
  "skills": {
    "main_idea": { "score": null, "evidence_count": 0, "trend": "unknown" },
    "factual_details": { "score": null, "evidence_count": 0, "trend": "unknown" },
    "inference": { "score": null, "evidence_count": 0, "trend": "unknown" },
    "vocabulary_context": { "score": null, "evidence_count": 0, "trend": "unknown" },
    "summary": { "score": null, "evidence_count": 0, "trend": "unknown" },
    "written_expression": { "score": null, "evidence_count": 0, "trend": "unknown" }
  },
  "grammar_focus": [],
  "words_to_review": [],
  "recent_sessions": [],
  "last_updated": null
}
